{"pass_types":["forward","progressive","key_pass"],"players":{"NTG_01":{"passes":[["m_022_e01151",9.3,2.0,56.6,8.5,1],["m_034_e01574",7.0,36.8,52.5,15.5,1],["m_015_e01858",21.9,37.4,66.8,68.2,1],["m_035_e01246",1.5,34.7,44.5,54.6,1],["m_034_e00712",8.2,50.3,51.0,47.8,1],["m_009_e00251",4.2,30.8,46.8,34.8,1],["m_022_e00882",10.2,50.3,51.6,25.2,1],["m_005_e00547",14.4,58.4,55.0,44.4,1],["m_024_e00387",7.9,43.8,48.4,68.2,1],["m_012_e01562",9.9,24.3,50.2,54.3,1],["m_032_e00812",8.0,50.0,45.2,73.8,1],["m_034_e00085",12.3,79.3,48.1,93.8,1],["m_002_e01937",14.3,81.7,49.8,49.9,1],["m_019_e01939",15.4,78.4,50.6,2.0,1],["m_029_e00437",8.0,50.0,43.1,63.6,1],["m_034_e00280",22.3,3.3,56.9,11.0,1],["m_032_e01041",7.0,33.9,40.2,36.9,1],["m_035_e00804",8.0,50.0,39.2,66.9,1],["m_015_e01084",10.0,49.5,40.7,45.3,1],["m_009_e01123",18.7,81.3,48.5,67.6,1],["m_012_e01858",16.1,31.5,45.9,42.2,1],["m_039_e00049",18.4,33.9,47.8,17.2,1],["m_014_e00507",5.5,38.0,25.4,42.6,1],["m_025_e00622",5.5,38.0,25.4,89.3,1],["m_024_e01338",5.5,62.0,25.3,63.9,1]],"shots_faced":[["m_002_e00049",133,7.5,46.4,"saved",0.34],["m_002_e00155",459,12.4,67.9,"saved",0.08],["m_002_e00928",2879,8.1,60.6,"saved",0.05],["m_002_e01352",4247,10.6,43.0,"off_target",0.2],["m_002_e01389",4331,11.5,70.9,"off_target",0.07],["m_002_e01665",5161,18.1,74.8,"off_target",0.03],["m_002_e01705",5295,16.6,91.3,"blocked",0.01],["m_002_e01828",5583,7.2,67.4,"goal",0.13],["m_002_e01915",5906,11.0,39.6,"blocked",0.16],["m_004_e00030",65,8.7,43.4,"off_target",0.07],["m_004_e00060",152,6.9,63.6,"saved",0.19],["m_004_e00068",213,12.6,49.2,"off_target",0.17],["m_004_e00272",821,13.5,47.7,"off_target",0.15],["m_004_e00505",1552,10.5,57.6,"goal",0.19],["m_004_e00726",2411,9.4,50.3,"off_target",0.07],["m_004_e00747",2483,10.4,47.1,"off_target",0.23],["m_004_e00925",2983,15.3,47.8,"off_target",0.11],["m_004_e00994",3171,12.3,44.0,"saved",0.16],["m_004_e01080",3480,3.0,63.7,"off_target",0.22],["m_004_e01145",3802,20.5,81.2,"saved",0.01],["m_004_e01390",4552,6.9,71.3,"off_target",0.02],["m_004_e01598",5208,8.3,35.4,"blocked",0.16],["m_005_e00331",1096,21.2,73.9,"off_target",0.02],["m_005_e00490",1578,21.1,46.9,"off_target",0.04],["m_005_e00643",2179,12.0,56.3,"blocked",0.17],["m_005_e00702",2343,5.8,46.5,"off_target",0.13],["m_005_e01069",3393,9.3,47.9,"goal",0.28],["m_005_e01095",3639,17.0,37.4,"saved",0.05],["m_005_e01339",4482,6.2,51.0,"goal",0.43],["m_005_e01435",4760,13.1,49.5,"off_target",0.16],["m_005_e01650",5457,5.5,45.4,"off_target",0.13],["m_009_e00406",1030,13.7,52.8,"off_target",0.03],["m_009_e00433",1122,15.8,57.0,"saved",0.09],["m_009_e00819",2052,9.0,26.3,"saved",0.07],["m_009_e00825",2060,8.0,50.0,"blocked",0.34],["m_009_e00939",2351,4.0,42.9,"goal",0.34],["m_009_e00964",2479,24.7,35.4,"goal",0.02],["m_009_e01246",3226,10.5,32.9,"off_target",0.11],["m_009_e01298",3357,6.6,48.2,"off_target",0.12],["m_009_e01478",3881,13.2,58.2,"blocked",0.13],["m_009_e01494",3911,12.0,68.0,"saved",0.08],["m_009_e01580",4141,19.0,50.2,"goal",0.05],["m_009_e01642",4513,24.8,58.4,"blocked",0.02],["m_009_e01765",5022,12.1,44.3,"saved",0.17],["m_009_e01818",5139,10.4,44.6,"blocked",0.22],["m_009_e02025",5743,12.7,40.3,"saved",0.13],["m_009_e02034",5759,5.6,43.1,"blocked",0.37],["m_009_e02095",5996,8.1,57.5,"saved",0.27],["m_012_e00337",827,11.6,49.5,"blocked",0.05],["m_012_e00478",1191,12.1,47.6,"off_target",0.04],["m_012_e00579",1428,5.8,41.3,"off_target",0.08],["m_012_e00727",1979,6.4,42.7,"off_target",0.09],["m_012_e00956",2669,11.9,53.5,"off_target",0.04],["m_012_e01649",4747,10.9,42.9,"off_target",0.04],["m_012_e01721",4901,10.3,67.4,"saved",0.02],["m_012_e01949",5499,12.1,51.8,"blocked",0.18],["m_014_e00148",403,4.0,23.8,"blocked",0.07],["m_014_e00506",1640,12.7,39.4,"off_target",0.1],["m_014_e00646",2035,11.5,52.0,"blocked",0.2],["m_014_e01268",3952,8.5,54.8,"blocked",0.07],["m_014_e01452",4581,13.7,62.3,"blocked",0.08],["m_014_e01494",4661,11.5,77.0,"off_target",0.04],["m_014_e01542",4792,12.3,53.9,"goal",0.17],["m_014_e01781",5740,10.8,53.7,"off_target",0.05],["m_015_e00750",2314,24.4,47.3,"blocked",0.03],["m_015_e00819",2544,16.3,22.0,"off_target",0.03],["m_015_e01592",4885,12.8,71.6,"off_target",0.06],["m_015_e01670",5269,22.1,60.9,"blocked",0.03],["m_015_e01893",5973,12.0,25.8,"off_target",0.05],["m_019_e00262",718,12.0,45.9,"saved",0.18],["m_019_e00266",755,9.9,54.4,"saved",0.06],["m_019_e00605",1702,9.0,23.0,"off_target",0.05],["m_019_e00707",2126,15.0,50.1,"saved",0.12],["m_019_e00799",2355,9.6,28.6,"off_target",0.08],["m_019_e00953",2838,11.7,57.6,"blocked",0.13],["m_019_e01318",3716,8.1,50.8,"saved",0.33],["m_019_e01368",3858,5.0,39.4,"off_target",0.28],["m_019_e01576",4500,16.1,35.7,"saved",0.07],["m_019_e01619",4590,12.5,52.0,"blocked",0.17],["m_019_e01688",4722,13.5,46.9,"saved",0.15],["m_019_e01708",4754,24.3,19.7,"off_target",0.01],["m_019_e01878",5270,7.2,29.2,"saved",0.02],["m_022_e00079",260,12.0,57.6,"goal",0.16],["m_022_e00162",562,7.8,42.9,"blocked",0.07],["m_022_e00248",877,23.8,77.2,"off_target",0.01],["m_022_e00297",1039,14.7,59.1,"blocked",0.1],["m_022_e00869",2860,4.4,42.9,"off_target",0.4],["m_022_e00920",2992,17.2,58.1,"off_target",0.07],["m_022_e00947",3066,10.8,53.3,"blocked",0.22],["m_022_e01287",4126,7.5,48.5,"off_target",0.1],["m_022_e01521",4820,12.2,49.6,"blocked",0.18],["m_022_e01828",5863,10.9,46.9,"goal",0.22],["m_024_e00204",563,9.9,23.0,"off_target",0.05],["m_024_e00362",1035,9.0,29.6,"off_target",0.09],["m_024_e00611",1745,8.1,65.1,"off_target",0.15],["m_024_e00695",2059,21.7,45.4,"off_target",0.04],["m_024_e00794",2393,12.0,62.5,"blocked",0.12],["m_024_e00921",2878,28.3,17.9,"blocked",0.0],["m_024_e01084",3346,11.0,61.9,"off_target",0.03],["m_024_e01274",3778,9.6,43.7,"saved",0.23],["m_024_e01560",4615,12.3,56.8,"off_target",0.16],["m_024_e01605",4732,7.1,88.9,"off_target",0.02],["m_024_e01819",5460,22.5,6.1,"saved",0.0],["m_024_e01933",5760,21.0,22.6,"blocked",0.02],["m_024_e01953",5824,18.9,88.2,"off_target",0.01],["m_024_e02008",6009,12.0,26.2,"off_target",0.05],["m_025_e00110",399,8.9,73.3,"off_target",0.07],["m_025_e00137",486,6.2,55.0,"saved",0.11],["m_025_e00259",715,5.7,17.7,"off_target",0.04],["m_025_e00539",1561,4.0,46.1,"goal",0.53],["m_025_e00621",1942,5.4,35.5,"off_target",0.05],["m_025_e00783",2379,14.2,68.0,"off_target",0.07],["m_025_e01132",3492,9.0,47.0,"saved",0.28],["m_025_e01482",4381,12.0,30.3,"off_target",0.07],["m_025_e01545",4697,22.3,43.7,"off_target",0.03],["m_025_e01859",5677,7.6,28.9,"off_target",0.09],["m_025_e01884",5761,5.4,42.5,"goal",0.36],["m_029_e00069",186,5.0,75.0,"saved",0.07],["m_029_e00106",310,10.7,46.8,"off_target",0.17],["m_029_e00361",1127,16.2,54.3,"off_target",0.09],["m_029_e00388",1246,17.4,57.4,"saved",0.05],["m_029_e00434",1372,9.0,75.2,"saved",0.06],["m_029_e00660",2215,10.5,50.0,"goal",0.78],["m_029_e00762",2603,6.6,26.5,"off_target",0.02],["m_029_e00769",2638,5.0,83.7,"off_target",0.03],["m_029_e00781",2679,14.5,49.6,"blocked",0.13],["m_029_e00906",3027,7.1,52.4,"off_target",0.11],["m_029_e00935",3117,15.7,54.6,"blocked",0.1],["m_029_e01189",3757,14.2,73.3,"off_target",0.05],["m_029_e01240",4017,7.4,49.2,"goal",0.11],["m_029_e01271",4148,8.0,47.9,"goal",0.33],["m_029_e01331",4327,14.1,45.2,"off_target",0.13],["m_029_e01351",4491,12.0,76.6,"saved",0.04],["m_029_e01369",4588,11.5,20.6,"saved",0.03],["m_029_e01443",4847,10.3,42.3,"blocked",0.2],["m_029_e01535",5208,14.8,69.5,"blocked",0.06],["m_029_e01562",5331,9.0,33.7,"saved",0.13],["m_029_e01590",5431,7.4,67.6,"off_target",0.13],["m_029_e01649",5595,23.0,79.2,"saved",0.01],["m_029_e01737",5862,9.0,56.6,"off_target",0.25],["m_032_e00009",22,10.8,63.8,"off_target",0.03],["m_032_e00018",57,9.2,50.8,"blocked",0.29],["m_032_e00178",479,24.7,68.8,"off_target",0.02],["m_032_e00274",743,6.3,48.9,"blocked",0.43],["m_032_e00277",748,11.1,70.6,"off_target",0.08],["m_032_e00290",792,11.5,46.6,"saved",0.19],["m_032_e00295",826,13.9,71.9,"saved",0.05],["m_032_e00690",2101,13.2,4.5,"saved",0.01],["m_032_e00809",2554,11.6,48.1,"saved",0.2],["m_032_e00890",2792,7.4,70.5,"off_target",0.02],["m_032_e01035",3206,11.6,52.7,"off_target",0.19],["m_032_e01135",3596,6.1,55.6,"saved",0.11],["m_032_e01281",4130,15.9,47.5,"off_target",0.1],["m_032_e01398",4512,22.5,46.1,"off_target",0.04],["m_032_e01460",4702,15.2,43.4,"off_target",0.1],["m_032_e01478",4912,7.2,53.1,"saved",0.1],["m_034_e00458",1119,10.7,43.1,"off_target",0.05],["m_034_e00621",1748,12.0,48.2,"goal",0.19],["m_034_e00781",2359,15.7,59.0,"goal",0.09],["m_034_e01123",3523,11.9,46.1,"saved",0.18],["m_034_e01159",3662,15.3,43.9,"blocked",0.1],["m_034_e01204",3749,14.1,60.2,"off_target",0.11],["m_034_e01529",4863,1.5,40.4,"goal",0.33],["m_034_e01616",5237,12.0,65.9,"blocked",0.1],["m_034_e01767",5723,15.7,37.6,"off_target",0.08],["m_034_e01886",6141,13.5,35.4,"goal",0.09],["m_035_e00163",422,24.0,42.4,"off_target",0.03],["m_035_e00262",689,7.9,49.1,"saved",0.34],["m_035_e00442",1155,12.0,30.8,"blocked",0.08],["m_035_e00569",1429,8.2,31.8,"off_target",0.12],["m_035_e00704",1889,5.6,67.3,"saved",0.15],["m_035_e00718",1949,23.1,53.5,"saved",0.03],["m_035_e00766",2047,21.0,84.8,"off_target",0.01],["m_035_e00801",2128,12.0,29.9,"saved",0.07],["m_035_e00926",2428,9.0,41.6,"goal",0.23],["m_035_e01137",3154,6.4,54.2,"saved",0.39],["m_035_e01152",3208,14.8,50.2,"blocked",0.12],["m_035_e01205",3349,14.2,63.5,"off_target",0.09],["m_035_e01413",4023,21.7,82.3,"off_target",0.01],["m_035_e01489",4224,23.6,56.1,"off_target",0.03],["m_035_e01543",4411,11.5,68.0,"goal",0.09],["m_035_e01608",4755,23.2,31.7,"off_target",0.01],["m_035_e01637",4860,12.1,46.6,"saved",0.18],["m_035_e01670",4992,16.6,54.3,"off_target",0.07],["m_035_e01727",5124,11.5,55.2,"blocked",0.19],["m_035_e01818",5428,9.8,50.0,"blocked",0.26],["m_035_e02054",6069,8.1,54.7,"goal",0.31],["m_039_e00077",282,22.4,41.6,"saved",0.03],["m_039_e00549",1807,7.0,60.6,"saved",0.24],["m_039_e00877",2570,24.0,26.2,"saved",0.01],["m_039_e01207",3591,9.1,33.2,"blocked",0.12],["m_